id,question,option1,option2,option3,option4,correctAnswer,rationale
Question 50,Which assessment most clearly points to Volkmann ischemic contracture as a potential complication?,A casted arm with warm fingers and strong pulse,An elbow-flexed cast with increasing finger pallor and poor radial pulse,A leg cast with itching relieved by cool air,A child with a body brace and mild muscle ache,B,"The lecture described Volkmann ischemic contracture as compression of the radial artery and nerve in an arm cast, leading to pallor, poor pulse, and eventual clawlike deformity."
Question 51,Which finding best fits osteogenesis imperfecta rather than inflicted injury alone?,Single fracture after a witnessed sports collision,Recurring fractures with a characteristic ribbonlike or mosaic bone pattern on X-ray,Bruises only over bony prominences on the shins,One buckle fracture after falling off a bike,B,"The lecture identified osteogenesis imperfecta as a collagen disorder with recurring fractures and a ribbonlike or mosaic pattern on X-ray, which can mimic abuse."
Question 52,"A child in traction suddenly reports tingling in the toes, and the foot appears cool. Which nursing action is best?",Document the finding and recheck in 4 hours,Increase the traction weight to improve alignment,Perform a focused neurovascular assessment and notify the provider,Encourage the child to wiggle the toes vigorously and rest,C,Coolness and tingling in the extremity in traction suggest neurovascular compromise. The lecture emphasized careful ongoing neurovascular assessment and prompt action.
Question 53,The nurse is teaching the family of an infant with clubfoot in serial casts. Which home instruction is most important to include?,Delay diaper changes so the cast is not disturbed often,Check the toes for coldness or blueness and assess capillary refill,Remove the cast nightly for passive ROM,Use powder inside the cast if the infant cries,B,"Because talipes casts extend high on the leg, the lecture emphasized frequent diaper changes and checking toe circulation by color and blanching."
Question 54,Which statement by a parent of a child with JIA indicates correct understanding of medication administration?,"'If my child is not complaining of pain, I can skip the NSAID dose.'",'The NSAID should be given on schedule because reducing inflammation matters even when pain is not obvious.','Methotrexate is avoided because it never helps joint disease.','Heat should not be used because it worsens stiffness.',B,The lecture explicitly emphasized continuing NSAIDs on schedule in JIA because their anti-inflammatory effect is as important as pain control.
Question 55,Which child is displaying the most classic presentation of SCFE?,A 4-year-old with bilateral toe walking and delayed milestones,"A preadolescent with gradual limp, painful internal hip rotation, and knee pain",A toddler with positive Ortolani and Barlow maneuvers,An adolescent with calf cramping after sports,B,"The lecture described SCFE as most common in preadolescents with gradual limp, referred knee pain, and painful limited internal rotation of the hip."
Question 56,The nurse is caring for a child after open reduction with a cast in place. Which finding is expected initially but still requires ongoing monitoring?,No drainage whatsoever from the operative site,A small amount of serosanguineous drainage that can be outlined and timed,Bright red spurting drainage soaking the cast edges,Complete numbness distal to the cast,B,The lecture noted a small amount of serosanguineous drainage may ooze into the cast after open reduction; it should be marked and timed to monitor progression.
Question 57,The nurse is counseling parents whose child has Legg-Calvé-Perthes disease. Which outcome is the best explanation for why activity restrictions matter?,"Without treatment the femoral head may remodel into a mushroom shape, causing later instability and degeneration.",Without treatment the tibial tuberosity will enlarge and require knee fusion.,Without treatment the radial artery will be compressed in the elbow.,Without treatment scoliosis will progress to 80 degrees within weeks.,A,"The lecture explained that untreated Legg-Calvé-Perthes can lead to mushroom-shaped remodeling of the femoral head, instability, degenerative change, and disability."
Question 58,Which finding most strongly suggests a pathologic process rather than routine sports soreness in a child with suspected osteomyelitis?,Pain after practice that improves with ice,"Fever, irritability, and warmth over a specific bone",Mild morning stiffness relieved by stretching,Calf cramps after wearing new shoes,B,"The lecture described osteomyelitis as presenting with vague systemic symptoms that progress to fever, warmth, edema, and bone pain."
Question 59,Which nurse statement best explains why a fracture through the epiphyseal line is especially concerning in a child?,'The bone will heal more slowly than an adult bone.',"'Damage to the growth plate can cause undergrowth, overgrowth, or angulation later.'",'It always causes fat embolism within hours.','It means the child definitely has osteogenesis imperfecta.',B,"The lecture emphasized that growth plate injuries can disrupt normal bone growth and lead to undergrowth, overgrowth, or angular deformity."
Question 60,Which action is most appropriate when a severely deformed extremity does not fit the contour of a splint?,Force the extremity into anatomic position before splinting,"Immobilize it as found, such as with sandbags, and avoid additional manipulation",Delay immobilization until X-ray confirmation,Apply a circumferential cast immediately,B,"The lecture stated that if the limb is too deformed to fit a splint, the nurse should not force it into position but immobilize it as found, such as with sandbags."
Question 61,A child with myasthenia gravis becomes suddenly much weaker and appears to have difficulty breathing. Which intervention is priority?,Encourage ambulation to build muscle strength,Call 911 or activate emergency response because respiratory arrest can occur,Offer a large meal before medication,Apply a heating pad to the chest,B,"The lecture stressed that sudden worsening weakness in myasthenia gravis can involve the intercostal muscles and lead to respiratory arrest, making it an emergency."
Question 62,The nurse is reviewing care for a child after scoliosis surgery. Which order or event would the nurse expect first as recovery begins?,Unlimited solid food immediately after surgery,Physical therapy beginning around postoperative day 1 with gradual activity increase,Removal of spinal rods before discharge,Independent twisting transfers in bed,B,"The lecture described NPO until bowel sounds return, then gradual advancement of intake, and physical therapy usually beginning on day 1 post-op."
Question 63,Which family statement about a Pavlik harness requires immediate correction?,'We will watch for redness beneath the straps.','We know the harness works by gentle continual pressure.',"'If the harness seems tight, we can change the strap adjustment ourselves.'",'We understand it is usually removed only for bathing.',C,The lecture emphasized that parents may remove and replace the harness for bathing but should not independently adjust strap positioning; provider-directed fit is essential.
Question 64,A school-age child with a long-leg cast asks why follow-up appointments are needed so often. Which response is best?,'Mostly so children can decorate new casts more often.',"'Because children can outgrow a cast quickly, and pressure on nerves or circulation can cause permanent problems.'",'So the cast can be removed nightly and replaced weekly.','Because all casts automatically loosen after 24 hours.',B,"The lecture stressed that children grow quickly and can outgrow a cast, which may compress nerves or circulation and lead to disability if not recognized."
Question 65,Which clinical picture is most suggestive of Osgood-Schlatter disease rather than SCFE?,Gradual limp with externally rotated leg and painful internal hip rotation,"Pain and swelling just below the knee in an active preadolescent, worse with squatting",Referred knee pain from a hip growth-plate slip,Morning joint stiffness with fever and rash,B,"Osgood-Schlatter disease causes pain at the tibial tuberosity below the knee and worsens with running or squatting, unlike SCFE, which originates at the hip."
Question 66,A nurse receives four calls from parents after orthopedic clinic visits. Which child should be seen first?,A child in a fiberglass cast who says the cast smells like marker after a friend wrote on it,"A child with a new arm cast whose fingers are blue, cool, and painful even after analgesic administration",A child with clubfoot whose diaper leaked near the upper edge of the cast but toes are pink,A child wearing a scoliosis brace who reports mild muscle ache during week one,B,"This combines multiple lecture priorities. Blue, cool, painful fingers despite analgesia suggest acute neurovascular compromise and possible compartment syndrome, requiring immediate evaluation."
Question 67,The nurse is preparing NCLEX-style teaching on traction. Which statement is most accurate and would best challenge a student who confuses traction types?,"Skin traction is preferred when prolonged, stronger pull is required because the skin tolerates high weights better than bone.","Skeletal traction requires a pin through the bone, raises infection concern at the pin site, and is used when stronger or longer traction is needed.",Bryant traction is a type of skeletal traction in which a pin is inserted into the femur of a toddler.,Any traction system can have its weights briefly removed during linen changes if the child is uncomfortable.,B,"The lecture differentiated skin and skeletal traction carefully: skeletal traction uses a pin or wire through bone, carries infection risk, and is used for longer or stronger traction. Weights should not be moved."
Question 68,Which finding best distinguishes JIA from osteomyelitis in a tricky pediatric exam question?,Elevated ESR and CRP,Limb pain and reduced willingness to move,Persistent fever with rash preceding chronic joint symptoms,Need for follow-up and family teaching,C,"Both conditions can involve inflammatory markers, pain, and follow-up. The lecture specifically highlighted persistent fever and rash before joint symptoms as a key clue for JIA."
Question 69,A nurse is asked which disorder most threatens future limb length because it directly damages the growth plate through infection if not adequately treated. Which answer is best?,Osgood-Schlatter disease,Osteomyelitis,Duchenne muscular dystrophy,Growing pains,B,"The lecture emphasized that osteomyelitis can destroy growth plates, which may shorten the affected extremity if treatment fails or is delayed."
Question 70,"Which nursing response is best when a parent says, 'My child just has growing pains, so I am not worried that the knee looks swollen and stiff every morning'?",'That fits growing pains because they often begin in the joints.',"'Growing pains usually affect the calf muscles, not joints, so knee swelling and stiffness should be evaluated.'",'Morning stiffness means the shoes are the wrong size.','Joint swelling is expected after normal growth spurts.',B,The lecture drew a sharp distinction: growing pains occur in the calf muscles and never in a joint. Swelling and stiffness suggest pathology such as JIA.
Question 71,Which combination of findings most strongly points to Legg-Calvé-Perthes rather than SCFE?,"Preadolescent with referred knee pain, external rotation, and painful internal hip rotation","Younger child with subtle limp, little hip pain, guarding with movement, and concern for avascular necrosis of the femoral epiphysis",Infant with unequal skin folds and positive Barlow maneuver,Active adolescent with tenderness over the tibial tuberosity,B,"Both SCFE and Perthes can cause limp, but the lecture identified Legg-Calvé-Perthes as avascular necrosis with subtle limp, relatively little hip pain, and guarding, often in younger children."
Question 72,A child with a femur fracture becomes confused and begins hallucinating. Which complication should the nurse suspect based on the lecture?,Pulmonary embolism from a distal DVT,Fat embolism from marrow entering the bloodstream,Hypocalcemia from immobilization,Volkmann ischemic contracture,B,The lecture described fat embolism as release of marrow fat into the bloodstream that can travel to cerebral vessels and cause confusion or hallucinations.
Question 73,Which teaching point is most important when a child with scoliosis begins brace therapy and reports discomfort during the first 2 weeks?,The brace should be removed frequently to shorten the adjustment period.,"Acetaminophen and rest may help mild muscle aches, but the brace should continue to be worn as prescribed.",Discomfort means the spine is worsening and surgery is now indicated.,The straps should be loosened until all soreness resolves.,B,"The lecture emphasized that mild muscle aches are common during early brace adjustment; acetaminophen and rest can help, but the brace should not be removed or loosened unnecessarily."
Question 74,A nurse is comparing a cast complication question with a fracture complication question. Which answer reflects correct pairing?,Increasing pain not relieved by medication after casting -> compartment syndrome; cerebral confusion after long-bone fracture -> fat embolism,Increasing pain after casting -> growing pains; cerebral confusion after long-bone fracture -> scoliosis,Cool fingers after casting -> Osgood-Schlatter disease; tachycardia after fracture -> DDH,Blue toes after casting -> JIA; dyspnea after fracture -> clubfoot,A,This item links two lecture complications: compartment syndrome after casting and fat embolism after long-bone fracture causing confusion or hallucinations.
Question 75,Which home-care scenario should make the nurse most concerned that a family does not understand the seriousness of immobilizer use?,A parent keeps a follow-up visit for a child in a boot.,"A child removes a splint most afternoons because it feels better, then puts it back on for bed.",A parent checks toe color every evening in a spica cast.,A child uses a backpack while on crutches.,B,The lecture noted that a disadvantage of boots and splints is that children may not wear them continuously; inconsistent use can delay or disrupt healing.
Question 76,"A toddler with suspected abuse has multiple fractures in various stages of healing, but the provider is also considering a rare musculoskeletal disorder from the lecture. Which condition most directly belongs in that differential?",SCFE,Osteogenesis imperfecta,JIA,Osgood-Schlatter disease,B,The lecture specifically warned that osteogenesis imperfecta can mimic maltreatment because frequent fractures may appear at different stages of healing.
Question 77,Which assessment finding after spinal fusion requires the nurse's most immediate follow-up because it threatens the surgical goal of preserving neurologic function?,The child reports embarrassment about body image,Upper and lower extremity neuro deficits appearing within the first 48 hours,The child wants to skip incentive spirometry,The family asks whether the rods stay in permanently,B,The lecture emphasized careful neurologic assessment of upper and lower extremities for at least 48 hours after scoliosis surgery.
Question 78,"A nurse is choosing the best explanation for why an infant with DDH is placed in a flexed, abducted, externally rotated position. Which answer is best?",To prevent pressure on the tibial tuberosity during growth spurts,To press the femoral head into the acetabulum so the socket deepens with gentle continual pressure,To correct the spinal curve before bracing is needed,To reduce edema around an infected metaphysis,B,"The lecture explained that DDH treatment positions the hip to press the femoral head against the acetabulum, encouraging proper socket contour development."
Question 79,"Which statement most accurately links cause, hallmark sign, complication, and nursing priority for osteomyelitis?",Bone infection leads to calf cramps; hallmark sign is clawed fingers; priority is hair-dryer teaching.,"Bone infection can reduce blood supply and form sequestrum; hallmark clues include fever, warmth, edema, and pain; prolonged antibiotics and follow-up are essential to prevent chronic infection and growth problems.",Hip avascular necrosis leads to knee pain; hallmark sign is external rotation; priority is brace fitting.,Overuse at the tibial tuberosity leads to swelling below knee; hallmark sign is rash; priority is pin-site care.,B,"This integrates several lecture points: osteomyelitis is a bone infection, can produce sequestrum from bone death, presents with fever/warmth/edema/pain, and requires prolonged treatment to prevent chronic disease and growth-plate damage."
Question 80,"A student says, 'Because children heal quickly, fractures through the epiphyseal plate are less serious than adult fractures.' Which correction by the instructor is best?","'Correct, because rapid healing prevents all deformity.'","'Incorrect, because damage at the growth plate can alter future growth even though the bone may heal quickly.'","'Incorrect, because children do not actually form callus.'","'Correct, unless the child also has scoliosis.'",B,"The lecture repeatedly contrasted rapid healing in children with the special danger of growth-plate injury, which can cause later deformity despite fast healing."
Question 81,A child with Duchenne muscular dystrophy is hospitalized with constipation and reduced mobility. Which nursing plan best addresses lecture priorities?,High-calorie diet and activity restriction to conserve muscles,"Low-calorie, high-protein intake; encourage ROM; support fluids, fiber, and stool softener as needed",Strict bed rest and high-fat supplements,Avoid bracing because it weakens the child psychologically,B,"The lecture noted keeping the child ambulatory as long as possible, using ROM, preventing excess weight gain, and addressing constipation with fluids, fiber, and stool softeners if needed."
Question 82,"Which scenario most clearly requires the nurse to think beyond the obvious injury and suspect child maltreatment, as emphasized in the musculoskeletal lecture tie-in?",A teenager fractures the radius while skateboarding with a consistent history,A nonmobile infant presents with a fracture and the history does not match developmental ability,A preadolescent develops knee pain after running track,A school-age child reports mild calf pain after a field day,B,"The lecture, reinforced by the maltreatment chapter, emphasized that fractures in a nonmobile infant or injuries inconsistent with developmental level are suspicious for maltreatment. fileciteturn0file2"
Question 83,A nurse is asked which postoperative or postprocedure teaching pair is correctly matched. Which answer is best?,Open reduction -> expect no drainage at all; Pavlik harness -> adjust straps whenever hips look stiff,Traction -> neurovascular checks are infrequent after the first hour; cast care -> warm hair dryer for itching,Open reduction -> mark small serosanguineous drainage with time; Pavlik harness -> check skin under straps daily,Scoliosis brace -> remove most of the day; clubfoot cast -> remove nightly for bathing,C,The lecture specifically taught marking and timing small drainage after open reduction and checking skin daily under a Pavlik harness.
Question 84,The nurse reviews four children who all complain of 'leg pain.' Which presentation most strongly suggests a condition with the greatest long-term risk of permanent hip damage if necrosis occurs before treatment?,School-age child with calf cramps after a new pair of shoes,"Preadolescent with gradual limp, referred knee pain, and painful internal rotation of the hip",Adolescent runner with swelling below the knee,Toddler with toe pain after serial casting,B,"This describes SCFE, which the lecture emphasized must be caught early before necrosis occurs, or reconstructive surgery may be needed and permanent motion loss can result."
Question 85,A child in a spica cast after hip surgery is being discharged. Which parent statement most concerns the nurse?,'We already arranged a special car seat that can fit the cast.','We will watch the toes for temperature and circulation.',"'If the cast seems tighter as my child grows, we will wait until the next routine visit unless there is severe pain.'",'We know rapid growth can create pressure problems in a cast.',C,"The lecture emphasized that children can outgrow casts quickly, including spica casts, and circulatory compression must not be ignored until a routine visit."
