id,question,option1,option2,option3,option4,correctAnswer,rationale
Question 1,"A 12-year-old returns 2 hours after a forearm cast was applied. The child received IV morphine 20 minutes ago but now reports worsening, deep pain and says the fingers feel 'asleep.' The fingers are pale and cool compared with the opposite hand. Which action should the nurse take first?",Reassure the family that pain often increases before a cast finishes drying,Elevate the arm higher and reassess in 2 hours,Notify the provider immediately because the findings suggest compartment syndrome,Encourage finger exercises and massage lotion around the cast opening,C,"The lecture stressed that pallor, pain, paresthesia, and coolness after casting suggest compartment syndrome and require immediate cast release evaluation to prevent permanent nerve and tissue damage."
Question 2,A nurse is teaching parents how to monitor a new leg cast at home. Which parent statement shows correct understanding of the most urgent problem to report during the first 24 hours?,"If my child says the cast is itchy, I will slide a ruler inside to check the skin.","If the toes look blue, swollen, or my child cannot move them, I will contact the provider right away.","If the cast gets wet, I will dry it on high heat with a hair dryer.","If the cast feels warm at first, that means the skin is burning.",B,"Home cast teaching includes checking distal digits for swelling, blueness, movement, and pain; these may indicate neurovascular compromise. Objects should never be inserted into a cast, and high heat should not be used."
Question 3,A child with a tibial fracture is being discharged with crutches. Which observation requires the nurse to intervene?,The child uses a backpack for school supplies,The child keeps the crutch pads pressed into the axilla while walking,The child places crutches about 6 inches to the side of the feet,The family removed throw rugs from the hallway,B,"The lecture emphasized that weight should be borne through the handgrips, not the axilla, to avoid soreness and neurovascular injury. A backpack and clear pathways are appropriate."
Question 4,A nurse caring for a child in skeletal traction is planning assessments for the first day. Which schedule is most appropriate?,Every 4 hours immediately after traction is applied,"Every 15 minutes for the first hour, then hourly for 24 hours, then every 4 hours","Every 30 minutes for 2 hours, then every shift",Once per shift unless the child reports pain,B,"The teacher specifically highlighted traction-related care: neurovascular checks every 15 minutes for the first hour, hourly for 24 hours, and every 4 hours thereafter."
Question 5,A hospitalized child is in skeletal traction for a femur fracture. Which nursing action is best?,Remove the weights briefly when changing bed linens so the child can be turned more easily,Keep the child flat at all times and avoid any repositioning,Change linens carefully without moving the weights or disrupting the traction,Place a pillow under the weights so they do not dangle,C,"In traction, the nurse should not move the weights or interfere with the traction setup. Linens and care must be performed carefully while maintaining traction alignment."
Question 6,A child returns from surgery after open reduction of a fractured arm and cast placement. A small amount of serosanguineous drainage is visible on the cast. Which nursing action is most appropriate?,Replace the entire cast because any drainage is abnormal,"Outline the drainage with a pen or crayon, add the time, and monitor for enlargement",Cover the drainage spot with tape to keep it from spreading,Ignore the drainage because it is expected for several days,B,"The lecture emphasized that a small amount of serosanguineous drainage can be normal after open reduction. The nurse should outline the stain, time it, and watch for enlargement that may suggest increased bleeding or infection."
Question 7,An 8-year-old wakes at night with calf discomfort after a day of soccer practice. Which finding would make the nurse question whether this is truly just 'growing pains'?,Pain located in the calf muscle after vigorous activity,Cramping that improves with warmth and rest,Pain described in the knee joint with swelling and morning stiffness,Symptoms occurring in a preschool- or school-age child,C,"The teacher emphasized that growing pains occur in the calf muscle, not in a joint. Joint pain, swelling, or stiffness suggests another condition such as JIA or rheumatic fever."
Question 8,"A school-age child has repeated fractures in different stages of healing, but the provider suspects osteogenesis imperfecta rather than abuse. Which additional finding best supports that diagnosis?",A ribbonlike or mosaic pattern on bone imaging,A single traumatic greenstick fracture after sports activity,Improvement after 24 hours of rest and NSAIDs,Positive Barlow and Ortolani maneuvers,A,"The musculoskeletal lecture noted that osteogenesis imperfecta is a collagen disorder with fragile bones and recurring fractures, and X-rays may show a ribbonlike or mosaic bone pattern."
Question 9,"A 7-year-old has a subtle limp, little hip pain, guarding with movement, and a follow-up X-ray planned in 3 weeks because the first film may still be normal. Which disorder does the nurse suspect?",Osgood-Schlatter disease,Legg-Calvé-Perthes disease,Slipped capital femoral epiphysis,Juvenile idiopathic arthritis,B,"Legg-Calvé-Perthes disease is avascular necrosis of the proximal femoral epiphysis. Early X-rays may be normal, so repeat imaging after about 3 weeks may be needed."
Question 10,An adolescent basketball player reports pain and swelling just below the knee that worsens with running and squatting. Which initial management is most consistent with the lecture?,Immediate spinal fusion,"NSAIDs, ice, rest, and limiting strenuous activity",Bed rest with traction for 6 weeks in all cases,Strict non-weight-bearing and hip screw fixation,B,"Osgood-Schlatter disease is an overuse injury of the tibial tuberosity. Initial therapy is usually conservative: NSAIDs, ice, rest, and reduced strenuous activity."
Question 11,"A preadolescent reports limping and knee pain, but the provider focuses on the hip. Which assessment finding would most strongly support slipped capital femoral epiphysis?",Calf cramping after activity relieved by rest,Painful and limited internal rotation of the hip,High fever and rash before joint pain,Positive Adams forward-bending test,B,"SCFE often presents gradually with limp and referred knee pain even though the pathology is in the hip. Internal rotation is difficult and painful, and the leg may rest externally rotated."
Question 12,"A child with sickle cell disease presents with fever, irritability, and sharp pain over the metaphysis of a long bone. By the next day, warmth and edema are present over the area. Which organism is the nurse especially alert for in this child?",Pseudomonas aeruginosa,Salmonella species,Neisseria meningitidis,Clostridioides difficile,B,"The lecture specifically noted that acute osteomyelitis is often due to Staph or Strep, but children with sickle cell disease have particular susceptibility to Salmonella in the bone."
Question 13,The nurse reviews an X-ray report on a child with osteomyelitis and notes the term sequestrum. What is the best interpretation?,A benign overgrowth of cartilage around the joint capsule,Dead bone tissue that appears dense on X-ray,A pathognomonic sign of clubfoot correction,A splinting complication caused by radial artery compression,B,The teacher emphasized that sequestrum refers to dead bone tissue in osteomyelitis and is an important diagnostic marker on X-ray.
Question 14,A school nurse screens an adolescent by having the student bend forward at the waist. The spinal curve becomes more obvious in this position. Which statement is most accurate?,This is the Barlow maneuver used for DDH screening,This is the Adams test used to screen for scoliosis,This confirms a curve greater than 40 degrees and need for surgery,This maneuver differentiates osteogenesis imperfecta from child maltreatment,B,The Adams forward-bending test is used in scoliosis screening because the asymmetry becomes more noticeable when the child bends forward.
Question 15,A child is found to have idiopathic scoliosis with a 16-degree curve and no respiratory compromise. Which management does the nurse anticipate?,No therapy now; close observation with periodic follow-up imaging while growth continues,Immediate spinal fusion because all structural curves worsen quickly,Milwaukee brace for 23 hours a day starting today,Halo traction because curves under 20 degrees progress rapidly,A,"The lecture states that curves less than 20 degrees are generally observed closely, with repeat evaluation such as X-rays every 6 months until growth maturity."
Question 16,A 13-year-old with scoliosis is prescribed a brace. Which statement by the adolescent shows the need for more teaching?,I should usually wear it 23 hours a day.,I can wear a T-shirt under the brace to protect my skin.,"If the brace rubs, I should loosen the straps myself until it feels comfortable.",Mild muscle aches at first can happen as my back adjusts.,C,The lecture warned families not to loosen brace straps on their own because that reduces corrective compression. The provider should be notified if rubbing occurs.
Question 17,A child is 12 hours postoperative after spinal fusion for scoliosis. Which nursing action is priority for safe repositioning?,Encourage the child to twist independently toward the side of comfort,Use a log-roll technique with assistance to maintain alignment,Keep the child completely immobile for 48 hours,Place the child in high Fowler's position and avoid turning,B,"After spinal instrumentation, the lecture emphasized log rolling to protect alignment and instrumentation while preventing pressure injury."
Question 18,A 6-year-old with juvenile idiopathic arthritis has less pain today and the parent asks whether the scheduled ibuprofen can be skipped. Which response by the nurse is best?,"Yes, because NSAIDs are only for pain and should be avoided when the child feels better","No, because the anti-inflammatory effect is important even when pain is not obvious","Yes, but replace it with vigorous exercise to maintain joint motion","No, but only because methotrexate cannot be given with food",B,The JIA lecture emphasized that NSAIDs should often be continued on schedule because they treat inflammation as well as pain; the child may still benefit even without obvious discomfort.
Question 19,A child with juvenile myasthenia gravis is increasingly weak by evening and coughs while eating dinner. Which intervention is most appropriate?,Schedule the largest meal after a rest period and monitor for swallowing difficulty,Encourage activity before meals to strengthen respiratory muscles,Hold all anticholinesterase medication if ptosis is present,Teach the family that worsening with fatigue suggests medication overdose only,A,Myasthenia gravis symptoms worsen with fatigue and stress. The lecture advised scheduling rest before meals because chewing and swallowing may be difficult.
Question 20,A toddler is newly diagnosed with Duchenne muscular dystrophy. Which nursing teaching is most appropriate?,Expect rapid full recovery if activity is restricted early,Encourage remaining ambulatory as long as possible with ROM exercises and support,Prevent all movement to avoid muscle degeneration,Focus primarily on high-calorie weight gain to improve strength,B,"For Duchenne muscular dystrophy, the lecture emphasized maintaining ambulation as long as possible, using active and passive ROM, bracing as needed, and avoiding excessive weight gain."
Question 21,A child arrives after a fall with a suspected lower-leg fracture. The leg is grossly deformed and does not fit the splint contour. What should the nurse do?,Force the limb gently into alignment so the splint will fit,"Immobilize it in the position found, such as with sandbags, and avoid moving it further",Delay immobilization until X-ray confirms fracture type,Massage the area to reduce swelling before splinting,B,"If the limb is severely deformed, the lecture advised not forcing it into splint position. Support it as found, such as with sandbags, to avoid further trauma."
Question 22,A child in an arm cast is being monitored for Volkmann ischemic contracture. Which finding is most concerning?,Warm fingers and brisk capillary refill,Hourly radial pulse present and fingers pink,"Cold, blanched fingers with worsening pain after flexed arm casting",Itching under the cast relieved by cool air,C,"Volkmann ischemic contracture occurs when circulation and nerve function are compromised after flexed arm casting. Coldness, blanching, and worsening pain are urgent warning signs."
Question 23,A breech-born female infant at her 2-week visit has unequal posterior thigh folds and one knee lower than the other when the hips are flexed. Which condition is the nurse most concerned about?,Talipes pseudodeformity,Developmental dysplasia of the hip,Osgood-Schlatter disease,Legg-Calvé-Perthes disease,B,"DDH risk is increased with breech birth, female sex, and first pregnancy. Unequal skin folds and unequal knee height with flexed hips are classic assessment findings."
Question 24,Parents of an infant with reducible developmental dysplasia of the hip are taught about the Pavlik harness. Which statement indicates correct understanding?,We should keep adjusting the harness straps ourselves as the baby kicks more.,"The harness should be worn continually except when bathing, and we need to check the skin daily.",The harness works best if we remove it often so the hips can rest.,We should expect the harness to hold the legs in adduction to deepen the acetabulum.,B,"The Pavlik harness is the method of choice for reducible DDH. It is worn continuously except for bathing, the skin must be checked daily, and frequent removal reduces its effectiveness."
Question 25,A newborn has true clubfoot and begins serial casting. Which parent teaching is most important to include?,Change diapers less often so the cast stays firmly positioned,Check the toes for blueness or coldness and keep urine or stool from soaking the cast,Expect the cast to end below the knee so the ankle can be corrected gradually,Plan to remove each cast at home weekly because rapid growth is expected,B,"For clubfoot, serial casts extend above the knee, diapers should be changed frequently to avoid soaking the cast, and parents must monitor toe circulation by checking color and warmth."
Question 26,A school nurse screens a 12-year-old girl for scoliosis. Which assessment finding is most consistent with the screening maneuver the lecture emphasized?,Asymmetry becomes more obvious when the child bends forward in the Adams test.,A positive Barlow maneuver indicates spinal rotation.,A positive Ortolani maneuver confirms thoracic curvature.,The curve is best detected when the child lies supine with knees flexed.,A,"The lecture emphasized the Adams forward-bend test for scoliosis screening; asymmetry becomes more apparent with bending. Ortolani and Barlow are hip tests, not scoliosis tests."
Question 27,The nurse is teaching parents about a newly applied arm cast. Which parent statement shows correct understanding?,"'If my child says the cast itches, I can slide a hanger inside to scratch it.'",'I should keep the casted arm elevated on a pillow during the first day.','Warm air from a hair dryer will help the cast dry and reduce itching.','Swimming is fine as long as the child avoids diving.',B,"The lecture stressed elevation during the first 24 hours to reduce swelling. Nothing should be inserted into a cast, warm air should not be used, and swimming is generally avoided."
Question 28,Which finding is the hallmark sign combination of a fracture in a child?,"Bradycardia, cyanosis, and petechiae","Malformation, edema, and pain","Fever, rash, and limp","Warmth, pallor, and clubbing",B,"The lecture specifically identified malformation, edema, and pain as hallmark fracture findings."
Question 29,A child in traction requires neurovascular checks. Which assessment finding should the nurse report first?,Child asks for a different game on the tablet,Absent peripheral pulse in the affected extremity,Mild boredom related to bed rest,Parent asks when the child can return to school,B,Absent pulse suggests neurovascular compromise and was repeatedly emphasized as urgent in cast and traction care.
Question 30,Which child is at highest risk for developmental dysplasia of the hip according to the lecture?,Male infant born vertex in a third pregnancy,Female infant born breech in a first pregnancy,Male infant with formula intolerance,Female infant born at term to a multigravida without risk factors,B,"The lecture emphasized breech presentation, female sex, and first pregnancy as major DDH risk factors."
Question 31,Which assessment finding best supports suspected DDH in an infant?,Positive Babinski reflex,Unequal posterior thigh skin folds and one knee appearing lower when hips are flexed,Bulging fontanel and sunset eyes,Pain on passive finger extension,B,"The lecture noted unequal skin folds and apparent leg-length discrepancy, especially seen with the hips flexed, as classic DDH findings."
Question 32,The nurse teaches the parents of an infant in a Pavlik harness. Which statement by the parents indicates need for further teaching?,'We will check the skin under the straps every day.','We will remove the harness often during the day so the baby can stretch.','We know the hips need to stay flexed and abducted.','We understand the harness is usually worn continuously except when bathing.',B,The harness works by gentle continuous pressure. Frequent removal makes treatment ineffective and was specifically cautioned against in lecture.
Question 33,A child reports worsening pain in a casted leg 15 minutes after receiving morphine. Which complication should the nurse suspect first?,Osteogenesis imperfecta,Compartment syndrome,Growing pains,Rheumatic fever,B,The lecture strongly emphasized that pain increasing despite analgesia is a red flag for compartment syndrome.
Question 34,Which child statement is most consistent with Osgood-Schlatter disease?,"'My hip hurts a little, but my limp is barely noticeable.'",'The swelling and pain are just below my knee and get worse when I run.','My shoulders are uneven when I bend forward.','My calves cramp only at night after wearing new shoes.',B,"Osgood-Schlatter disease causes pain and swelling at the tibial tuberosity, just below the knee, and worsens with running or squatting."
Question 35,The nurse is explaining osteomyelitis to a parent. Which statement is most accurate?,'It is usually a viral infection limited to the joint space.',"'It is a bone infection that may cause warmth, edema, fever, and later dead bone tissue called sequestrum.'",'It affects only children with fractures.','It is best treated with a short 3-day course of oral antibiotics.',B,"The lecture described osteomyelitis as a bone infection, often bacterial, with fever, warmth, edema, and possible sequestrum seen on X-ray."
Question 36,Which finding most supports juvenile idiopathic arthritis rather than simple growing pains?,Pain located in the calf after vigorous activity,Nighttime cramping after a new pair of shoes,Persistent fever and rash before joint symptoms begin,Pain that always resolves with leg movement,C,"The lecture emphasized that JIA may present with persistent fever and rash before joint pain, whereas growing pains occur in the calf muscle and not in joints."
Question 37,A nurse caring for a child after scoliosis surgery understands proper turning technique is:,Trendelenburg repositioning,Log rolling with spinal alignment maintained,Independent twisting at the waist,Frequent prone positioning without assistance,B,The lecture specifically emphasized log rolling after spinal instrumentation to maintain alignment and protect the surgical repair.
Question 38,Which statement by a parent best reflects understanding of crutch safety?,'My child should rest body weight on the axillary pads for balance.','The rubber tips should be intact because they help prevent slipping.','The crutches should be placed directly under the feet when walking.','A shoulder bag is safer than a backpack for carrying books.',B,"The lecture stressed that crutch tips must be intact to prevent slips; weight should be borne through the hands, not the axillae."
Question 39,Which condition is best described as avascular necrosis of the proximal femoral epiphysis?,SCFE,Legg-Calvé-Perthes disease,Osgood-Schlatter disease,Osteomyelitis,B,The lecture defined Legg-Calvé-Perthes disease as avascular necrosis of the proximal femoral epiphysis.
Question 40,A nurse assessing a child with suspected SCFE would expect which finding?,Severe elbow pain with clawed fingers,External rotation of the affected leg with knee pain,Pain isolated to the calf muscle at night,Fixed spinal curve corrected by lying down,B,"SCFE often presents gradually with limp, externally rotated leg, and referred knee pain despite the pathology being in the hip."
Question 41,Which statement about clubfoot management is correct?,Serial casting usually begins years later after walking starts.,The cast or brace extends above the knee to ensure correction.,The infant should wear regular low-top shoes after the first cast.,Parents should avoid checking the toes because it may loosen the cast.,B,The lecture emphasized early serial casting and that the cast/brace extends above the knee for firm correction; parents should monitor toe circulation.
Question 42,A child with myasthenia gravis is eating lunch. Which nursing action is best?,Encourage the child to finish quickly before fatigue sets in,Schedule a rest period before meals,Give the medication only after the meal to avoid aspiration,Limit fluids to decrease drooling,B,"The lecture stressed that chewing and swallowing become difficult with fatigue in myasthenia gravis, so rest before meals is helpful."
Question 43,Which statement is most accurate regarding Duchenne muscular dystrophy?,It most often affects girls because it is mitochondrial.,It is the most common childhood muscular dystrophy and usually occurs in boys.,It presents with sudden fever and rash.,It is caused by excessive dystrophin production.,B,"The lecture stated Duchenne muscular dystrophy is the most common childhood muscular dystrophy, is X-linked recessive, and usually occurs in boys."
Question 44,Which action best reflects appropriate care of a child in skeletal traction?,Move the weights briefly during linen change so the child can turn more easily,Provide pin-site care and watch for drainage or odor,Remove the cotton gauze around the pin and leave the site open to air at all times,Check neurovascular status once per shift only,B,Skeletal traction requires careful pin-site care and monitoring for infection; weights should not be moved and neurovascular checks are frequent.
Question 45,A child returns after a fracture reduction and is crying with cool pale fingers distal to the cast. What is the nurse's priority action?,Offer diversional play,Notify the provider immediately for possible cast release,Teach the parent about diet high in calcium,Encourage vigorous finger exercises without reassessment,B,"Cool pale fingers suggest neurovascular compromise and possible compartment syndrome, which the lecture described as an emergency requiring immediate action."
Question 46,The nurse is differentiating growing pains from more serious disorders. Which feature most strongly suggests the pain is NOT simple growing pains?,Pain occurs in the calf after vigorous activity,The child wakes at night with cramping in the calf,Pain is centered in a joint with swelling and stiffness,The child recently changed shoe style,C,The lecture stressed that growing pains occur in the calf muscle and never in a joint. Joint pain suggests another disorder such as JIA or rheumatic fever.
Question 47,A parent asks why the provider wants a repeat X-ray in 3 weeks for a child thought to have hip synovitis. Which response is best?,'This checks whether scoliosis is developing from limping.',"'Early Legg-Calvé-Perthes changes may not be visible right away, so repeat imaging helps distinguish the two conditions.'",'The first film probably missed a fracture because the child moved.','We repeat X-rays routinely after all minor hip pain.',B,The lecture explained that Legg-Calvé-Perthes disease may initially resemble synovitis and early X-ray changes may not appear until about 3 weeks later.
Question 48,Which child would the nurse suspect of possible osteomyelitis related to a unique organism association discussed in lecture?,A child with sickle cell disease and bone pain,A child with scoliosis and back brace discomfort,A child with clubfoot in serial casting,A child with Duchenne muscular dystrophy and constipation,A,The lecture noted that children with sickle cell disease are particularly susceptible to Salmonella osteomyelitis.
Question 49,The nurse is preparing discharge teaching for a child with a body brace for scoliosis. Which statement by the nurse is best?,"'Loosen the straps whenever the skin rubs, then tighten them later.'",'The brace should be worn over a T-shirt and usually stays on 23 hours a day.','The brace can be removed all evening as long as it is worn at school.','Muscle aches mean the brace is harming the spine and should be stopped.',B,Scoliosis bracing is typically worn 23 hours a day over a T-shirt. Straps should not be loosened by the family if rubbing occurs; the provider should be notified.
